{
  "accepted_task01_commit": "af3820836a6ffa92c63016b0e308f624f9b42db0",
  "algorithm_config_sha256": "1db1e859767d04b11afa94b156f8f3c5cf97cd93912325b20c05a46b4b663188",
  "algorithm_defaults": {
    "binary_threshold": 128,
    "component_connectivity": 8,
    "hole_connectivity": 4,
    "skeleton_algorithm": "skimage.morphology.skeletonize",
    "symmetry_alignment": "representation_canvas",
    "tonal_bins": 32
  },
  "constructs": [
    {
      "calibration_status": "uncalibrated_proxy",
      "code": "D1_balance",
      "description": "Distribution of visual mass and space.",
      "interpretation_boundary": "Offset is descriptive and is not automatically bad.",
      "name_en": "Balance",
      "name_zh": "平衡"
    },
    {
      "calibration_status": "uncalibrated_proxy",
      "code": "D2_symmetry",
      "description": "Reflection correspondence on a declared representation.",
      "interpretation_boundary": "No monotonic aesthetic direction is assumed.",
      "name_en": "Symmetry",
      "name_zh": "对称"
    },
    {
      "calibration_status": "uncalibrated_proxy",
      "code": "D3_proportion_scale",
      "description": "Relations among extents, ink, and negative space.",
      "interpretation_boundary": "No golden-ratio optimum is encoded.",
      "name_en": "Proportion and scale",
      "name_zh": "比例与尺度"
    },
    {
      "calibration_status": "uncalibrated_proxy",
      "code": "D4_unity_consistency",
      "description": "Variation in a shared visible form system.",
      "interpretation_boundary": "Hierarchy is not treated as inconsistency by default.",
      "name_en": "Unity and consistency",
      "name_zh": "统一与一致性"
    },
    {
      "calibration_status": "uncalibrated_proxy",
      "code": "D5_rhythm_sequence",
      "description": "Repeated or varying formal sequences.",
      "interpretation_boundary": "Formal sequence is not measured reading speed.",
      "name_en": "Rhythm and sequence",
      "name_zh": "节奏与序列"
    },
    {
      "calibration_status": "uncalibrated_proxy",
      "code": "C1_brushwork_line_quality",
      "description": "Visible stroke-result width and continuity proxies.",
      "interpretation_boundary": "Raster evidence cannot recover the writing action.",
      "name_en": "Brushwork and line quality",
      "name_zh": "笔法与线质"
    },
    {
      "calibration_status": "uncalibrated_proxy",
      "code": "C2_character_structure",
      "description": "Internal occupancy and topology.",
      "interpretation_boundary": "Default comparison is within character and script cohorts.",
      "name_en": "Character structure",
      "name_zh": "结体"
    },
    {
      "calibration_status": "uncalibrated_proxy",
      "code": "C3_spatial_arrangement",
      "description": "Ink and negative-space organization at declared object levels.",
      "interpretation_boundary": "Glyph-internal and whole-layout measures remain separate.",
      "name_en": "Spatial arrangement",
      "name_zh": "布白与章法"
    },
    {
      "calibration_status": "uncalibrated_proxy",
      "code": "C4_ink_tone",
      "description": "Tonal and edge-level measurements on C_ink.",
      "interpretation_boundary": "Binary digital glyphs are explicitly not applicable.",
      "name_en": "Ink tone",
      "name_zh": "墨法与墨色"
    },
    {
      "calibration_status": "uncalibrated_proxy",
      "code": "C5_qi_movement_proxy",
      "description": "Direction, continuity, width, and connectivity measurements.",
      "interpretation_boundary": "Only low-level proxies are observed; qi is not directly measured.",
      "name_en": "Movement proxies",
      "name_zh": "气韵与行气代理"
    }
  ],
  "dimensions": [
    {
      "code": "geometry",
      "description": "Contour, reflection, and topology measurements.",
      "name_en": "Geometry",
      "name_zh": "几何度"
    },
    {
      "code": "density",
      "description": "Ink and negative-space occupancy measurements.",
      "name_en": "Density",
      "name_zh": "稠密度"
    },
    {
      "code": "proportion",
      "description": "Relative extents and scale relationships.",
      "name_en": "Proportion",
      "name_zh": "比例"
    },
    {
      "code": "stroke_gesture",
      "description": "Skeleton direction and width-result proxies, not writing actions.",
      "name_en": "Stroke gesture",
      "name_zh": "笔势"
    },
    {
      "code": "layout",
      "description": "Spatial arrangement on the preserved canvas.",
      "name_en": "Layout",
      "name_zh": "排版"
    },
    {
      "code": "visual_center",
      "description": "Foreground mass location on the preserved canvas.",
      "name_en": "Visual center",
      "name_zh": "视觉重心"
    },
    {
      "code": "reading_rhythm",
      "description": "Visible sequence structure, not psychological reading speed.",
      "name_en": "Formal sequence",
      "name_zh": "阅读节奏"
    },
    {
      "code": "uniformity",
      "description": "Variation among visible components or stroke-result measurements.",
      "name_en": "Uniformity",
      "name_zh": "统一度"
    }
  ],
  "features": [
    {
      "algorithm": {
        "default_config_sha256": "1db1e859767d04b11afa94b156f8f3c5cf97cd93912325b20c05a46b4b663188",
        "name": "binary occupancy",
        "parameter_schema": {
          "type": "object"
        },
        "version": "2.0.0"
      },
      "applicability": {
        "missing_codes": [
          "EMPTY_FOREGROUND"
        ],
        "requires": [
          "nonempty foreground"
        ]
      },
      "construct_mappings": [
        {
          "citation_ids": [
            "S09"
          ],
          "construct_code": "D3_proportion_scale",
          "evidence_level": "B",
          "role": "secondary_proxy"
        },
        {
          "citation_ids": [
            "S17"
          ],
          "construct_code": "C3_spatial_arrangement",
          "evidence_level": "A",
          "role": "primary_proxy"
        }
      ],
      "cross_script_comparability": "direct",
      "definition_version": "2.0.0",
      "denominator": "canvas_pixels",
      "dimensions": {
        "primary": "density",
        "secondary": [
          "layout"
        ]
      },
      "feature_code": "ink_coverage_ratio",
      "formula": "foreground_pixels / canvas_pixels",
      "input_representations": [
        "A_layout",
        "B_shape",
        "raster_binary"
      ],
      "known_biases": [
        "Threshold and canvas protocol affect the ratio."
      ],
      "literature_sources": [
        "S09",
        "S17"
      ],
      "name_en": "Ink coverage",
      "name_zh": "墨迹覆盖率",
      "numerator": "foreground_pixels",
      "object_levels": [
        "single_glyph",
        "multi_glyph",
        "ecological_image",
        "calligraphy"
      ],
      "schema_version": "1.0.0",
      "status": "core",
      "unit": "ratio",
      "value_range": {
        "maximum": 1,
        "minimum": 0
      },
      "zero_meaning": "No foreground under the frozen threshold."
    },
    {
      "algorithm": {
        "default_config_sha256": "1db1e859767d04b11afa94b156f8f3c5cf97cd93912325b20c05a46b4b663188",
        "name": "binary bbox occupancy",
        "parameter_schema": {
          "type": "object"
        },
        "version": "2.0.0"
      },
      "applicability": {
        "missing_codes": [
          "EMPTY_FOREGROUND",
          "ZERO_DENOMINATOR"
        ],
        "requires": [
          "nonempty foreground bbox"
        ]
      },
      "construct_mappings": [
        {
          "citation_ids": [
            "S09"
          ],
          "construct_code": "D3_proportion_scale",
          "evidence_level": "B",
          "role": "primary_proxy"
        },
        {
          "citation_ids": [
            "S17"
          ],
          "construct_code": "C2_character_structure",
          "evidence_level": "A",
          "role": "secondary_proxy"
        }
      ],
      "cross_script_comparability": "direct",
      "definition_version": "2.0.0",
      "denominator": "foreground_bbox_pixels",
      "dimensions": {
        "primary": "density",
        "secondary": [
          "proportion"
        ]
      },
      "feature_code": "bbox_fill_ratio",
      "formula": "foreground_pixels / foreground_bbox_pixels",
      "input_representations": [
        "B_shape",
        "raster_binary"
      ],
      "known_biases": [
        "B_shape target geometry must be human confirmed."
      ],
      "literature_sources": [
        "S09",
        "S17"
      ],
      "name_en": "Bounding-box fill",
      "name_zh": "字框填充率",
      "numerator": "foreground_pixels",
      "object_levels": [
        "single_glyph",
        "multi_glyph",
        "ecological_image",
        "calligraphy"
      ],
      "schema_version": "1.0.0",
      "status": "core",
      "unit": "ratio",
      "value_range": {
        "maximum": 1,
        "minimum": 0
      },
      "zero_meaning": "No foreground occupancy."
    },
    {
      "algorithm": {
        "default_config_sha256": "1db1e859767d04b11afa94b156f8f3c5cf97cd93912325b20c05a46b4b663188",
        "name": "foreground extent",
        "parameter_schema": {
          "type": "object"
        },
        "version": "2.0.0"
      },
      "applicability": {
        "missing_codes": [
          "EMPTY_FOREGROUND",
          "ZERO_DENOMINATOR"
        ],
        "requires": [
          "positive bbox height"
        ]
      },
      "construct_mappings": [
        {
          "citation_ids": [
            "S01"
          ],
          "construct_code": "D3_proportion_scale",
          "evidence_level": "B",
          "role": "primary_proxy"
        },
        {
          "citation_ids": [
            "S17"
          ],
          "construct_code": "C2_character_structure",
          "evidence_level": "A",
          "role": "diagnostic"
        }
      ],
      "cross_script_comparability": "direct",
      "definition_version": "2.0.0",
      "denominator": "bbox_height",
      "dimensions": {